Sku,Item,Category,Price,Quantity,Totals
BRD114,"BRAD - ORGANIC YELLOW CHIPS","Brad's Organic","$ 2.66",12,$31.92
BRD201,"BRAD - ORG MILD SALSA","Brad's Organic","$ 3.7",12,$44.4
BRD202,"BRAD - ORG MEDIUM SALSA","Brad's Organic","$ 3.7",12,$44.4
BRD203,"BRAD - ORG HOT SALSA","Brad's Organic","$ 3.7",12,$44.4
BRD204,"BRAD - ORG RSTD GARLIC SALSA","Brad's Organic","$ 3.7",12,$44.4
BRD101,"BRAD ORGANIC BLUE CHIP SLT 8oz","Brad's Organic","$ 2.66",12,$31.92
BRD181,"BRAD ORG RICE CAKES L/S 4.6oz","Brad's Organic Rice Cakes","$ 2.2",12,$26.4
BRD182,"BRAD ORG RICE CAKES N/S 4.6oz","Brad's Organic Rice Cakes","$ 2.2",12,$26.4
TB102,"TASTY BITE ORG MADRAS LENTILS","Tasty Bite (ready to eat)","$ 2.99",6,$17.94
TB104,"TASTY BITE PUNJAB EGGPLNT 10oz","Tasty Bite (ready to eat)","$ 2.66",6,$15.96
TB109,"TASTY BITE ORG MADRAS 3 BEAN","Tasty Bite (ready to eat)","$ 2.99",6,$17.94
TB124,"TASTY BITE VINDALOO SPICY","Tasty Bite (ready to eat)","$ 2.66",6,$15.96
BRD275,"BRAD - ORG CANNED PUMPKIN 15oz","Brad's Organic Pumpkin","$ 2.66",24,$63.84
FM101,"F. MARKET - PUMPKIN PUREE OG","Farmer's Market","$ 2.66",24,$63.84
BRD663,"BRAD ORG KOSHER VEG BROTH 32oz","Brad's Organic Broths","$ 2.66",12,$31.92
RD507,"IMAGINE VEGETABLE BROTH 32oz","Imagine (32oz soup)","$ 3.46",12,$41.52
RD509,"IMAGINE FREE RANGE CHICK 32oz","Imagine (32oz soup)","$ 3.46",12,$41.52
RD511,"IMAGINE TOMATO BASIL SOUP 32oz","Imagine (32oz soup)","$ 4.66",12,$55.92
RD513,"IMAGINE L/S CHICK BROTH 32oz","Imagine (32oz soup)","$ 3.46",12,$41.52
RD514,"IMAGINE L/S VEG BROTH 32oz","Imagine (32oz soup)","$ 3.46",12,$41.52
RD515,"IMAGINE L/S NO-CHICK BRTH 32oz","Imagine (32oz soup)","$ 3.46",12,$41.52
PA102,"PACIFIC - ORG CHICK BROTH 32oz","Pacific (soup)","$ 3.56",12,$42.72
PA103,"PACIFIC - OG L/S VEG BRTH 32oz","Pacific (soup)","$ 3.15",12,$37.8
PA202,"PACIFIC- OG CREAMY TOMATO 32oz","Pacific (soup)","$ 3.73",12,$44.76
PA210,"PACIFIC CSHW CARROT GNGER 32oz","Pacific (soup)","$ 3.73",12,$44.76
PA222,"PACIFIC OG L/S BTRNT SQSH 32oz","Pacific (soup)","$ 3.73",12,$44.76
PA105,"PACIFIC - ORG VEG BROTH 4-pk","Pacific (soup)","$ 3.33",6,$19.98
PA106,"PACIFIC - ORG CHICK BROTH 4-pk","Pacific (soup)","$ 3.73",6,$22.38
PA106A,"PACIFIC ORG L/S CHICK BRTH 4pk","Pacific (soup)","$ 3.73",6,$22.38
BRD317,"BRAD - ORG GLAZE BALSAMIC 8.5","Brad's Organic Oil & Vinegar","$ 4",12,$48
BRD338,"BRAD ORG COCONUT MILK REG","Brad's Organic Coconut","$ 2.66",12,$31.92
BRD332,"BRAD ORG COCONUT OIL REF 14oz","Brad's Organic Coconut","$ 6.19",6,$37.14
BRD333,"BRAD ORG COCNUT OIL UNREF 14oz","Brad's Organic Coconut","$ 7.53",6,$45.18
BRD334,"BRAD ORG 32oz COCONUT OIL REF","Brad's Organic Coconut","$ 8.79",6,$52.74
BRD643,"BRAD ORG BROWN BASMATI 2lb","Brad's Organic Grains","$ 5.86",6,$35.16
LU102,"LUNDBERG - ORG LONG RICE 2lb","Lundberg (2lb rice)","$ 4.91",6,$29.46
LU106,"LUNDBERG ORG BROWN BASMATI 2lb","Lundberg (2lb rice)","$ 6.54",6,$39.24
LU109,"LUNDBERG ORG BROWN JASMINE 2lb","Lundberg (2lb rice)","$ 6.54",6,$39.24
BRD355,"BRAD ORG YELLOW MUSTARD 10oz","Brad's Organic Condiments","$ 2.66",12,$31.92
BRD357,"BRAD ORG DELI STYLE MUSTARD","Brad's Organic Condiments","$ 2.66",12,$31.92
BRD383,"BRAD ORG SLICED JALAPENOS","Brad's Organic Condiments","$ 4",12,$48
BRD381,"BRAD ORG RSTD RED PEPPERS","Brad's Organic Condiments","$ 4",12,$48
NP501,"N.PATH - ORIGINAL HOT CEREAL","Nature's Path Hot Cereal","$ 3.66",12,$43.92
NP502,"N.PATH - APPLE CINN HOT CEREAL","Nature's Path Hot Cereal","$ 3.66",12,$43.92
NP503,"N.PATH - MAPLE NUT HOT CEREAL","Nature's Path Hot Cereal","$ 3.66",12,$43.92
NP504,"N.PATH - FLAX PLUS HOT CEREAL","Nature's Path Hot Cereal","$ 3.66",12,$43.92
NP505,"N.PATH - HOT CEREAL VARIETY","Nature's Path Hot Cereal","$ 3.66",12,$43.92
NP506,"N.PATH - OPT CINN BB HOT","Nature's Path Hot Cereal","$ 3.66",12,$43.92
NP521,"N.PATH - G/F OAT SPICED APPLE","Nature's Path Hot Cereal","$ 4.33",12,$51.96
NP522,"N.PATH - G/F OATMEAL HOMESTYLE","Nature's Path Hot Cereal","$ 4.33",12,$51.96
NP523,"N.PATH - G/F OAT SUGAR MAPLE","Nature's Path Hot Cereal","$ 4.33",12,$51.96
NP524,"N.PATH - G/F OATMEAL VARIETY","Nature's Path Hot Cereal","$ 4.33",12,$51.96
BRD221,"BRAD - ORG LOW FAT MARINARA","Brad's Organic Pasta Sauce","$ 3.7",12,$44.4
BRD233,"BRAD - ORG F/F L/S GARDEN VEG","Brad's Organic Pasta Sauce","$ 3.7",12,$44.4
PB101,"BRADS NATRL P.B. SMOOTH","Brad's Nut Butters","$ 2.66",12,$31.92
PB102,"BRADS NATRL P.B CRUNCHY","Brad's Nut Butters","$ 2.66",12,$31.92
,,,,,$2206.62
