Sku,Item,Category,Price,Quantity,Totals
BRD338,"BRAD ORG COCONUT MILK REG","Brad's Organic Coconut","$ 2.66",12,$31.92
BRD691,"BRADS - ORG COCONUT WATER","Brad's Organic Coconut","$ 4.66",48,$223.68
BRD692,"BRADS - ORG COCONUT MILK DRINK","Brad's Organic Coconut","$ 4.66",12,$55.92
ES211,"N. FOREST OG COCONUT CREAM 5.4","Native Forest Condiments","$ 1.39",12,$16.68
BRD231,"BRAD - ORG F/F L/S MARINARA","Brad's Organic Pasta Sauce","$ 3.7",12,$44.4
BRD233,"BRAD - ORG F/F L/S GARDEN VEG","Brad's Organic Pasta Sauce","$ 3.7",12,$44.4
BRD232,"BRAD - ORG F/F L/S TOMTO BASIL","Brad's Organic Pasta Sauce","$ 3.7",12,$44.4
BRD224,"BRAD - ORG LOW FAT PORTABELLO","Brad's Organic Pasta Sauce","$ 3.7",12,$44.4
BRD222,"BRAD - ORG LOW FAT TOMTO BASIL","Brad's Organic Pasta Sauce","$ 3.7",12,$44.4
BRD223,"BRAD - ORG LOW FAT RSTD GARLIC","Brad's Organic Pasta Sauce","$ 3.7",12,$44.4
BRD452,"BRAD ORG RICE CORN PENNE G/F","Brad's Organic Gluten Free Pasta","$ 2.66",12,$31.92
BRD467,"BRAD ORG RICE & KALE RIGATI","Brad's Organic Gluten Free Pasta","$ 4.57",12,$54.84
BRD463,"BRAD ORG CHICKPEA ELBOWS G/F","Brad's Organic Gluten Free Pasta","$ 4.57",15,$68.55
BRD433,"BRAD ORG WHOLE WHT MED SHELLS","Brad's Organic Pasta","$ 2",20,$40
BRD434,"BRAD ORG WHOLE WHT FUSILLI","Brad's Organic Pasta","$ 2",20,$40
BRD441,"BRAD ORG TRI COLOR FUSILLI","Brad's Organic Pasta","$ 2",20,$40
BRD663,"BRAD ORG KOSHER VEG BROTH 32oz","Brad's Organic Broths","$ 2.66",12,$31.92
BRD661,"BRAD ORG KOSHER CHCK BRTH 32oz","Brad's Organic Broths","$ 2.66",12,$31.92
BRD644,"BRAD ORG WHITE BASMATI 2lb","Brad's Organic Grains","$ 5.86",12,$70.32
BRD642,"BRAD ORG LONG BROWN RICE 2lb","Brad's Organic Grains","$ 4.33",6,$25.98
BRD641,"BRAD ORG SHORT BROWN RICE 2lb","Brad's Organic Grains","$ 4.33",12,$51.96
BRD601,"BRAD - ORG BLACK BEANS","Brad's Organic Beans","$ 1.72",24,$41.28
BRD625,"BRAD - ORG NO SALT KIDNEY BEAN","Brad's Organic Beans","$ 1.72",12,$20.64
BRD628,"BRAD - ORG NO SALT CANNELLINI","Brad's Organic Beans","$ 1.72",12,$20.64
BRD610,"BRAD - ORG SALAD BEANS","Brad's Organic Beans","$ 1.72",12,$20.64
BRD603,"BRAD - ORG KIDNEY BEANS","Brad's Organic Beans","$ 1.72",24,$41.28
BRD602,"BRAD - ORG GARBANZO BEANS","Brad's Organic Beans","$ 1.72",12,$20.64
BRD392,"BRAD ORG HRTS PALM SPEARS cans","Brad's Organic Hearts Palm","$ 4",12,$48
BRD391,"BRAD ORG HRTS PALM SLICES jars","Brad's Organic Hearts Palm","$ 3.55",12,$42.6
BRD390,"BRAD ORG HRTS PALM SPEARS jars","Brad's Organic Hearts Palm","$ 4.88",12,$58.56
BRD393,"BRAD ORG HRTS PALM SLICES cans","Brad's Organic Hearts Palm","$ 3",12,$36
BRD347,"BRAD ORGANIC CANE SUGAR","Brad's Organic Sugar",$3.80,12,$45.6
BRD345,"BRAD ORG COCONUT SUGAR 14oz","Brad's Organic Sugar",$4,12,$48
BRD348,"BRAD ORG STEVIA 50ct","Brad's Organic Sugar",$3.80,20,$76
BRD275,"BRAD - ORG CANNED PUMPKIN 15oz","Brad's Organic Pumpkin","$ 2.66",12,$31.92
BRD573,"BRAD ORG DECAF GREEN TEA 20ct","Brad's Organic Tea","$ 3.33",6,$19.98
BRD567,"BRAD - ORGANIC GREEN TEA 20ct","Brad's Organic Tea","$ 3.33",6,$19.98
BRD570,"BRAD - ORG GINGER TEA 20ct","Brad's Organic Tea","$ 3.33",6,$19.98
BRD575,"BRAD - ORG CHAMOMILE TEA 20ct","Brad's Organic Tea","$ 3.33",6,$19.98
Y107,"YOGI - LEMON GINGER reg","Yogi Tea","$ 3.75",6,$22.5
Y401,"YOGI - PURE GREEN TEA","Yogi Tea","$ 3.75",6,$22.5
Y121,"YOGI - KAVA STRESS RELIEF","Yogi Tea","$ 3.75",6,$22.5
Y205,"YOGI - PEPPERMINT","Yogi Tea","$ 3.75",6,$22.5
Y158,"YOGI - GINGER CITRUS TURMERIC","Yogi Tea",$3.75,6,$22.5
Y115,"YOGI - STOMACH EASE","Yogi Tea","$ 3.75",6,$22.5
Y127,"YOGI - HONEY LEMON THROAT","Yogi Tea","$ 3.75",6,$22.5
BRD714,"BRAD ORG COCONUT ALMND GRANOLA","Brad's Organic Granola","$ 3.8",8,$30.4
BRD701,"BRAD ORG OATMEAL ORIGINAL","Brad's Organic Oatmeal","$ 3.2",6,$19.2
BRD537,"BRAD - 44oz ORG BLUE AGAVE","Brad's Organic Agave Syrup","$ 9.99",6,$59.94
BRD533,"BRAD - ORG BLUE AGAVE 23.5oz","Brad's Organic Agave Syrup","$ 6",12,$72
BRD541,"BRAD ORG MAPLE DARK A 8oz","Brad's Organic Maple Syrup","$ 7",12,$84
BRD544,"BRAD ORG MAPLE DARK A 32oz","Brad's Organic Maple Syrup","$ 20",6,$120
BRD544B,"BRAD ORG A/B VERY DRK MPL 32oz","Brad's Organic Maple Syrup","$ 20",6,$120
BRD543,"BRAD ORG MAPLE DARK A 16oz","Brad's Organic Maple Syrup","$ 12.66",12,$151.92
BRD358,"BRAD ORG DIJON MUSTARD","Brad's Organic Condiments","$ 2.66",12,$31.92
BRD360,"BRAD ORGANIC KETCHUP 24oz","Brad's Organic Condiments","$ 3.13",12,$37.56
BRD381,"BRAD ORG RSTD RED PEPPERS","Brad's Organic Condiments","$ 4",12,$48
BRD383,"BRAD ORG SLICED JALAPENOS","Brad's Organic Condiments","$ 4",12,$48
F240,"FIRST - ORANGE BLOSSOM 1lb","1st International Honey","$ 3.53",12,$42.36
F241,"FIRST - CLOVER 1lb","1st International Honey","$ 3.53",12,$42.36
BRD373,"BRAD ORG HNY MUSTARD DRESSING","Brad's Organic Dressing 12oz","$ 3.33",12,$39.96
BRD374,"BRAD ORG ITAL DRESSING W/ PEPP","Brad's Organic Dressing 12oz","$ 3.33",12,$39.96
BRD375,"BRAD ORG RASPBERRY VINAIGRETTE","Brad's Organic Dressing 12oz","$ 3.33",12,$39.96
BRD376,"BRAD ORG SESAME GNGER DRESSING","Brad's Organic Dressing 12oz","$ 3.33",12,$39.96
BRD317,"BRAD - ORG GLAZE BALSAMIC 8.5","Brad's Organic Oil & Vinegar","$ 4",12,$48
BRD351,"BRAD NTRL AVOCADO OIL 33.8oz","Brad's Organic Oil & Vinegar","$ 12.66",12,$151.92
BRD308,"BRAD OG SPNSH EV OLIV OIL 33.8","Brad's Organic Oil & Vinegar","$ 10.33",12,$123.96
BRD352,"BRAD REF GRAPESEED OIL 1 liter","Brad's Organic Oil & Vinegar","$ 10.66",12,$127.92
BRD302,"BRAD OG TRKSH OLIVE OIL 500ml","Brad's Organic Oil & Vinegar","$ 6.5",12,$78
BRD291,"BRAD PINK HIMALAYN SLT grinder","Brad's Natural Spices","$ 5",12,$60
BRD294,"BRAD BLK PEPPERCORN grinder","Brad's Natural Spices","$ 6.2",18,$111.6
BRD290,"BRAD ATLANTIC SEA SALT grinder","Brad's Natural Spices","$ 5",12,$60
BRD181,"BRAD ORG RICE CAKES L/S 4.6oz","Brad's Organic Rice Cakes","$ 2.2",24,$52.8
BRD186,"BRAD ORG CORN CAKES MILK CHOC","Brad's Organic Rice Cakes","$ 2.66",12,$31.92
BRD185,"BRAD ORG CORN CAKES DARK CHOC","Brad's Organic Rice Cakes","$ 2.66",12,$31.92
BRD184,"BRAD ORG RICE CAKES MILK CHOC","Brad's Organic Rice Cakes","$ 2.66",12,$31.92
BRD183,"BRAD ORG RICE CAKES DARK CHOC","Brad's Organic Rice Cakes","$ 2.66",12,$31.92
PB102,"BRADS NATRL P.B CRUNCHY","Brad's Nut Butters","$ 2.66",12,$31.92
PB201,"BRADS - ORGANIC PB SMOOTH","Brad's Nut Butters","$ 4",12,$48
PB104,"BRADS - NATURAL CASHEW BUTTER","Brad's Nut Butters","$ 8.66",12,$103.92
PB204,"BRADS - ORGANIC CASHEW BUTTER","Brad's Nut Butters","$ 10.66",12,$127.92
PB133,"BRADS NATURAL MACADAMIA COCOA","Brad's Nut Butters","$ 10",6,$60
BJ304,"BRAD - ORG CHERRY FRUIT SPREAD","Brad's Organic Fruit Spreads","$ 4.66",8,$37.28
BJ303,"BRAD - ORG MIX BERRY FRT SPRD","Brad's Organic Fruit Spreads","$ 4.66",8,$37.28
BRD146,"BRAD - NATRL VEGGIE CHIPS G/F","Brad's Organic","$ 3.33",12,$39.96
BRD145,"BRAD - NATRL VEGGIE STRAWS G/F","Brad's Organic","$ 3.33",12,$39.96
BRD178,"BRAD - ORG PRETZ STICK OAT BRN","Brad's Organic Pretzels","$ 2.19",12,$26.28
BRD174,"BRAD - ORG PRETZELS SPELT","Brad's Organic Pretzels","$ 2.19",24,$52.56
BRD171,"BRAD - ORG PRETZELS STICKS","Brad's Organic Pretzels","$ 2.19",12,$26.28
BRD173,"BRAD - ORG PRETZ UNSALTD ROUND","Brad's Organic Pretzels","$ 2.19",12,$26.28
,,,,,$4538.25
