Sku,Item,Category,Price,Quantity,Totals
BRD290,"BRAD ATLANTIC SEA SALT grinder","Brad's Natural Spices","$ 5",12,$60
BRD291,"BRAD PINK HIMALAYN SLT grinder","Brad's Natural Spices","$ 5",18,$90
BRD292,"BRAD GARLIC SEA SALT grinder","Brad's Natural Spices","$ 5.66",6,$33.96
BRD294,"BRAD BLK PEPPERCORN grinder","Brad's Natural Spices","$ 6.2",12,$74.4
BRD641,"BRAD ORG SHORT BROWN RICE 2lb","Brad's Organic Grains","$ 4.33",6,$25.98
BRD644,"BRAD ORG WHITE BASMATI 2lb","Brad's Organic Grains","$ 5.86",6,$35.16
BRD644A,"BRAD ORG 5lb WHITE BASMTI sack","Brad's Organic Grains","$ 12.5",6,$75
BRD633,"BRAD - ORGANIC QUINOA 14oz","Brad's Organic Grains","$ 6.25",24,$150
BRD634,"BRAD - ORG CHIA SEEDS 14oz","Brad's Organic Grains","$ 5",24,$120
BRD661,"BRAD ORG KOSHER CHCK BRTH 32oz","Brad's Organic Broths","$ 2.66",24,$63.84
BRD662,"BRAD - ORG L/S CHICK BRTH 32oz","Brad's Organic Broths","$ 2.66",12,$31.92
BRD663,"BRAD ORG KOSHER VEG BROTH 32oz","Brad's Organic Broths","$ 2.66",12,$31.92
BRD625,"BRAD - ORG NO SALT KIDNEY BEAN","Brad's Organic Beans","$ 1.72",24,$41.28
BRD624,"BRAD - ORG NO SALT GARBANZO","Brad's Organic Beans","$ 1.72",12,$20.64
BRD601,"BRAD - ORG BLACK BEANS","Brad's Organic Beans","$ 1.72",12,$20.64
BRD602,"BRAD - ORG GARBANZO BEANS","Brad's Organic Beans","$ 1.72",12,$20.64
BRD603,"BRAD - ORG KIDNEY BEANS","Brad's Organic Beans","$ 1.72",12,$20.64
BRD452,"BRAD ORG RICE CORN PENNE G/F","Brad's Organic Gluten Free Pasta","$ 2.66",12,$31.92
BRD453,"BRAD ORG RICE CORN FUSILI G/F","Brad's Organic Gluten Free Pasta","$ 2.66",12,$31.92
BRD350,"BRAD NTRL AVOCADO OIL 16.9oz","Brad's Organic Oil & Vinegar","$ 6.66",24,$159.84
BRD351,"BRAD NTRL AVOCADO OIL 33.8oz","Brad's Organic Oil & Vinegar","$ 12.66",24,$303.84
BRD306,"BRAD OG SPNSH EV OLVE OIL 16.9","Brad's Organic Oil & Vinegar","$ 6.5",12,$78
BRD308,"BRAD OG SPNSH EV OLIV OIL 33.8","Brad's Organic Oil & Vinegar","$ 10.33",12,$123.96
BRD305,"BRAD OG SPNSH EV OLIVE OIL 8.5","Brad's Organic Oil & Vinegar","$ 3.33",12,$39.96
BRD311,"BRAD - ORG BALSAMIC VNG MODENA","Brad's Organic Oil & Vinegar","$ 3.33",12,$39.96
BRD312,"BRAD - ORG RED WINE VINEGAR","Brad's Organic Oil & Vinegar","$ 2.66",12,$31.92
BRD381,"BRAD ORG RSTD RED PEPPERS","Brad's Organic Condiments","$ 4",12,$48
BRD387,"BRAD ORG CAPERS","Brad's Organic Condiments","$ 2.86",24,$68.64
BRD373,"BRAD ORG HNY MUSTARD DRESSING","Brad's Organic Dressing 12oz","$ 3.33",12,$39.96
BRD376,"BRAD ORG SESAME GNGER DRESSING","Brad's Organic Dressing 12oz","$ 3.33",12,$39.96
BRD232,"BRAD - ORG F/F L/S TOMTO BASIL","Brad's Organic Pasta Sauce","$ 3.7",12,$44.4
BRD561,"BRAD -  ORG BEDTIME TEA 20ct","Brad's Organic Tea","$ 3.33",12,$39.96
BRD565,"BRAD ORG GINGER TURMERIC TEA","Brad's Organic Tea","$ 3.33",12,$39.96
BRD566,"BRAD ORG LEMON GINGER TEA 20ct","Brad's Organic Tea","$ 3.33",6,$19.98
BRD567,"BRAD - ORGANIC GREEN TEA 20ct","Brad's Organic Tea","$ 3.33",12,$39.96
BRD568,"BRAD - ORG PEPPERMINT TEA 20ct","Brad's Organic Tea","$ 3.33",6,$19.98
BRD569,"BRAD - ORG THROAT TEA 20ct","Brad's Organic Tea","$ 3.33",6,$19.98
BRD571,"BRAD - ORG ECHINACEA TEA 20ct","Brad's Organic Tea","$ 3.33",6,$19.98
BRD574,"BRAD ORG ROOIBOS CHAI TEA 20ct","Brad's Organic Tea","$ 3.33",6,$19.98
BRD577,"BRAD - ORG MORINGA TEA 20ct","Brad's Organic Tea","$ 4",12,$48
BRD578,"BRAD - ORG MORINGA LMN GINGER","Brad's Organic Tea","$ 4",12,$48
BRD181,"BRAD ORG RICE CAKES L/S 4.6oz","Brad's Organic Rice Cakes","$ 2.2",12,$26.4
BRD182,"BRAD ORG RICE CAKES N/S 4.6oz","Brad's Organic Rice Cakes","$ 2.2",24,$52.8
BRD183,"BRAD ORG RICE CAKES DARK CHOC","Brad's Organic Rice Cakes","$ 2.66",12,$31.92
BRD184,"BRAD ORG RICE CAKES MILK CHOC","Brad's Organic Rice Cakes","$ 2.66",12,$31.92
BRD185,"BRAD ORG CORN CAKES DARK CHOC","Brad's Organic Rice Cakes","$ 2.66",12,$31.92
BRD533,"BRAD - ORG BLUE AGAVE 23.5oz","Brad's Organic Agave Syrup","$ 6",12,$72
BRD537,"BRAD - 44oz ORG BLUE AGAVE","Brad's Organic Agave Syrup","$ 9.99",36,$359.64
BRD538,"BRAD - 44oz ORG RAW BLUE AGAVE","Brad's Organic Agave Syrup","$ 9.99",36,$359.64
BRD543,"BRAD ORG MAPLE DARK A 16oz","Brad's Organic Maple Syrup","$ 12.66",12,$151.92
BRD544,"BRAD ORG MAPLE DARK A 32oz","Brad's Organic Maple Syrup","$ 20",6,$120
BRD544B,"BRAD ORG A/B VERY DRK MPL 32oz","Brad's Organic Maple Syrup","$ 20",6,$120
BRD515,"BRAD ORG RAW HONEY 18oz","Brad's Organic Honey","$ 9.16",12,$109.92
BRD511C,"BRAD ORG WILDFLWR HONEY 35.3oz","Brad's Organic Honey","$ 10",6,$60
BRD528C,"BRAD NATURAL WILDFLOWR 35.3oz","Brad's Natural Honey","$ 7.5",6,$45
PB201,"BRADS - ORGANIC PB SMOOTH","Brad's Nut Butters","$ 4",12,$48
PB202,"BRADS - ORGANIC PB CRUNCHY","Brad's Nut Butters","$ 4",12,$48
PB203,"BRADS - ORGANIC ALMOND BUTTER","Brad's Nut Butters","$ 13.33",12,$159.96
BRD345,"BRAD ORG COCONUT SUGAR 14oz","Brad's Organic Sugar",$4,12,$48
BRD714,"BRAD ORG COCONUT ALMND GRANOLA","Brad's Organic Granola","$ 3.8",8,$30.4
BRD715,"BRAD ORG PUMPKIN FLAX GRANOLA","Brad's Organic Granola","$ 3.8",8,$30.4
BRD716,"BRAD ORG ISLAND PISTACHIO GRAN","Brad's Organic Granola","$ 3.8",8,$30.4
BRD339,"BRAD ORG COCONUT MILK LIGHT","Brad's Organic Coconut","$ 2.66",12,$31.92
,,,,,$4314.24
