Sku,Item,Category,Price,Quantity,Totals
BRD641,"BRAD ORG SHORT BROWN RICE 2lb","Brad's Organic Grains","$ 4.33",6,$25.98
BRD644,"BRAD ORG WHITE BASMATI 2lb","Brad's Organic Grains","$ 5.86",6,$35.16
RD504,"IMAGINE CREAMY BROCOLI 32oz","Imagine (32oz soup)","$ 4.66",12,$55.92
RD511,"IMAGINE TOMATO BASIL SOUP 32oz","Imagine (32oz soup)","$ 4.66",12,$55.92
RD514,"IMAGINE L/S VEG BROTH 32oz","Imagine (32oz soup)","$ 3.46",12,$41.52
BRD542,"BRAD ORG MAPLE DARK A 12oz","Brad's Organic Maple Syrup","$ 9.66",12,$115.92
BRD533,"BRAD - ORG BLUE AGAVE 23.5oz","Brad's Organic Agave Syrup","$ 6",12,$72
PA405,"PACIFIC - ORG UNSW ALMOND ORIG","Pacific (milk)","$ 2.74",12,$32.88
PA208,"PACIFIC- OG RSTD PEPP TOM 32oz","Pacific (soup)","$ 3.73",12,$44.76
PA202,"PACIFIC- OG CREAMY TOMATO 32oz","Pacific (soup)","$ 3.73",12,$44.76
WS201,"WHOLESOME ORG MOLASSES 16oz","Wholesome Sweeteners","$ 4.53",12,$54.36
WS113,"WHOLESOME ORG POWDERED SUGAR","Wholesome Sweeteners","$ 3.7",12,$44.4
BRD611,"BRAD - ORG CANNELLINI BEANS","Brad's Organic Beans","$ 1.72",12,$20.64
BRD601,"BRAD - ORG BLACK BEANS","Brad's Organic Beans","$ 1.72",120,$206.4
BRD359,"BRAD ORG N/S WHL GRAIN MUSTARD","Brad's Organic Condiments","$ 2.66",12,$31.92
BRD360,"BRAD ORGANIC KETCHUP 24oz","Brad's Organic Condiments","$ 3.13",120,$375.6
PB204,"BRADS - ORGANIC CASHEW BUTTER","Brad's Nut Butters","$ 10.66",12,$127.92
PB203,"BRADS - ORGANIC ALMOND BUTTER","Brad's Nut Butters","$ 13.33",12,$159.96
BRD332,"BRAD ORG COCONUT OIL REF 14oz","Brad's Organic Coconut","$ 6.19",6,$37.14
HA161,"H.BABY TEETHERS BLUE CARROT","Happy Baby","$ 4.06",6,$24.36
HA163,"H.BABY TEETHERS PEA & SPINACH","Happy Baby","$ 4.06",6,$24.36
HA162,"H.BABY TEETHERS BANANA SWT POT","Happy Baby","$ 4.06",6,$24.36
HA402,"H.BABY CC STAGE 1 PRUNES","Happy Baby","$ 1.66",16,$26.56
HA101,"HAPPY BABY PUFFS APPLE","Happy Baby","$ 2.93",6,$17.58
HA104,"HAPPY BABY PUFFS SWEET POT G/F","Happy Baby","$ 2.93",6,$17.58
GE124,"GOE - MULTIGRAIN CHIPS 5.5oz","Garden of Eatin","$ 2.66",12,$31.92
GE129,"GOE - YELLOW CORN CHIPS 5.5oz","Garden of Eatin","$ 2.66",12,$31.92
GE121,"GOE - BLUE CORN CHIPS 5.5oz","Garden of Eatin",$2.66,12,$31.92
GE125,"GOE - SESAME BLUE CHIPS 5.5oz","Garden of Eatin","$ 2.66",12,$31.92
GE122,"GOE - BLUE NO SALT CHIPS 5.5oz","Garden of Eatin","$ 2.66",12,$31.92
GE128,"GOE - WICKED HOT CHIPS 5.5oz","Garden of Eatin","$ 2.66",12,$31.92
GE123,"GOE - RED HOT BLUE CHIPS 5.5oz","Garden of Eatin","$ 2.66",12,$31.92
BRD114,"BRAD - ORGANIC YELLOW CHIPS","Brad's Organic","$ 2.66",60,$159.6
BRD101,"BRAD ORGANIC BLUE CHIP SLT 8oz","Brad's Organic","$ 2.66",60,$159.6
BRD182,"BRAD ORG RICE CAKES N/S 4.6oz","Brad's Organic Rice Cakes","$ 2.2",12,$26.4
TB101,"TASTY BITE BOMBAY POTATO 10oz","Tasty Bite (ready to eat)","$ 2.66",6,$15.96
TB102,"TASTY BITE ORG MADRAS LENTILS","Tasty Bite (ready to eat)","$ 2.99",6,$17.94
TB103,"TASTY BITE KASHMIR SPINCH 10oz","Tasty Bite (ready to eat)","$ 2.66",6,$15.96
TB104,"TASTY BITE PUNJAB EGGPLNT 10oz","Tasty Bite (ready to eat)","$ 2.66",6,$15.96
TB105,"TASTY BITE JAIPUR VEG 10oz","Tasty Bite (ready to eat)","$ 2.66",6,$15.96
TB106,"TASTY BITE ORG COCONUT SQ DAL","Tasty Bite (ready to eat)","$ 2.99",6,$17.94
TB107,"TASTY BITE ORG JODPHUR DAL","Tasty Bite (ready to eat)","$ 2.99",6,$17.94
TB109,"TASTY BITE ORG MADRAS 3 BEAN","Tasty Bite (ready to eat)","$ 2.99",6,$17.94
TB110,"TASTY BITE SPINACH DAL 10oz","Tasty Bite (ready to eat)","$ 2.66",6,$15.96
TB114,"TASTY BITE VEGTABLE KORMA 10oz","Tasty Bite (ready to eat)","$ 2.66",6,$15.96
TB115,"TASTY BITE ORG CHANNA MASALA","Tasty Bite (ready to eat)","$ 2.99",6,$17.94
TB117,"TASTY BITE MUSHRM MASALA 10oz","Tasty Bite (ready to eat)","$ 2.66",6,$15.96
TB122,"TASTY BITE VEG TIKKA MASALA","Tasty Bite (ready to eat)","$ 2.66",6,$15.96
TB124,"TASTY BITE VINDALOO SPICY","Tasty Bite (ready to eat)","$ 2.66",6,$15.96
TB125,"TASTY BITE COCONUT VEG HOT","Tasty Bite (ready to eat)","$ 2.66",6,$15.96
,,,,,$2536.3
